,text_final,site_final
0,annotation callout appearance views use usage interactivity default,iOS
1,marker drag populates new location map create draggable coordinates a display,Mapbox GL JS
2,extrude fill property for indoor height 3d paint map create mapping polygon,Mapbox GL JS
3,js gl code using application need build a guide map walks store j mapbox locator,Help
4,street app view learn quickly map create simple a display,Android
5,much visible zoom level determines map,Help
6,navigation functionality advanced app ios add,iOS
7,after result set gl marker mark used point location style geocoder a,Mapbox GL JS
8,data known esri vector file also shapefile geographic storing format,Help
9,storyboards set navigation storyboard xcode,iOS
10,gl property layer data maps layout paint properties use two rendered and sub decides,Help
11,options set cameraoptions bearing zoom map pitch center and extend,Mapbox GL JS
12,navigation sdk internationalization and ios overview localization,iOS
13,load source using vector tile style use third custom third-party party,iOS
14,county layer data using depending zoom level choropleth update by state 2014 census population a display,Mapbox GL JS
15,data draw drawing style defines map specification appearance order describes visual,Mapbox GL JS
16,work marker with markers mapbox.js map custom interactive add in js,Help
17,rerouting navigation customize sdk app learn use detection route ios experience,iOS
18,api queries buildings tilequery within meters features 50 example click location single use request map make tileset search a 10,Android
19,associated directions direction show quickly item recyclerview route,Android
20,provided poi sample maps sdk placement overview unity scene,Unity
21,annotation view selection views animated custom,iOS
22,control known fine within layer filter also style gives grained macos ios predicate content,Help
23,api gl the control using element place attached geocoder map use search geocoding places input outside,Mapbox GL JS
24,layer within feature user allow style select a,iOS
25,tableau introduction analytics get extension geographic started,Geographic Analytics
26,snapshot static take even share app notification map use photo snapshotter others device,Android
27,draw parsing annotation file line polyline geojson add a from,iOS
28,desktop application tilemill maps designing,Help
29,latitude coordinate longitude combination,Help
30,official documentation within features maps feature place discover information android selected retrieve map sdk interest query querying,Android
31,draw coordinate turf ring use hollow calculate circle around eventually coordinates center,Android
32,the change labels downcase case expressions use label upcase of,Mapbox GL JS
33,api navigation sdk android map use custom ui matching route,Android
34,api symbollayer draw icon along directions line moving moves behind route,Android
35,gradient mapview effect show fog background add top,Android
36,fill property water zoom color level layers case depend dependent map make on,Android
37,local layer data vector zoom level tile choropleth geometries json update style by map styling driven a,Android
38,tap click location to map photo select add device,Android
39,mapillary symbollayer real data icon example markers via also integration manipulate time add showcased,Android
40,api gl google using maps to map guide convert walks web switch mapbox from js,Help
41,layer source show toggleable hide and add a,iOS
42,api dance connects 3d runtime environment ambient audio based map building rhythm styling sound web on creating animate buildings,Mapbox GL JS
43,layer source detailed shading hillshade raster slope dem add a,Mapbox Studio manual
44,marker with icon map use custom icons add,Mapbox GL JS
45,property data-driven data with color style circle visualization creating expression a,Mapbox GL JS
46,marker position location updating frame animate a,Mapbox GL JS
47,name place taking latitude address values process longitude geocoding converting,Help
48,api see space time real icon international update based location response on station,Android
49,code examples navigation sdk example ios,iOS
50,features collection dataset editable geojson,Help
51,online designing maps interface editor mapbox,Help
52,hosted with using style map custom a display,Mapbox GL JS
53,datasets work data using scratch new learn create geospatial,Help
54,draw filter geometry geometries file single geojson multiple,Android
55,camera set source external up use instead built an device,iOS
56,api gl image images static standalone based style map request generated allows,Help
57,image containing included style single icons sprite,Help
58,api delimited the sources source ids feature tilesets beta use learn line handle tileset create and geojson,Help
59,fill layer choropleth expressions style map use create add a,Mapbox Studio manual
60,window separate android map release use in picture maintain,Android
61,one far zoom docs provide bar certain features android another plugin scale read map various level display,Android
62,api published data recipes source recipe feature describe look beta tilesets behave tileset,Help
63,camera set source external up use instead built an device,Android
64,api road data openstreetmap take recorded network gps snap map tracker path allows matching traces,Help
65,source raster add dynamically imagery,iOS
66,clustered data maps sdk show android learn clustering map use,Android
67,name typing text filter icon by symbols symbol input,Mapbox GL JS
68,gl synchronize swipe maps between map use two compare,Mapbox GL JS
69,system pair position coordinate plane used latitude describe geographic longitude numbers and coordinates,Help
70,layer using source properties style line map create geojson add a,Android
71,project take next level tutorial get guide help step started find,Help
72,hotspots hotspot data visualize maps sdk point use create from,Android
73,the dynamically icon runtime missing generate to map and add a,Mapbox GL JS
74,official documentation api matrix sdk java,Android
75,api delete edit access token create tokens allows,Help
76,control heatmap styling coloring gain minute heatmaps,Android
77,vision ios navigation ar introduction,iOS
78,existing data change feature realtime update map updating in a,Mapbox GL JS
79,one layer source geometry polygon circle geojson add multiple from,Mapbox GL JS
80,fragment using within library android include app map support,Android
81,the pre change cartography maps sdk android style learn map team custom use styling talented made,Android
82,clustered images symbollayer view clustering use icons geojson,Android
83,specific choose function picker place plugin location use places world,Android
84,api the with using walk access permanent temporary token creating tokens,Help
85,learn work map offline maps,Help
86,gl marker dynamically icon samples or markers style ways custom tooltips interactive add overview js,Help
87,landsat satellite source everywhere imagery live latest landsat-live world,Help
88,basemap a style to map carto add mapbox,Help
89,ios sdk navigation introduction brief,iOS
90,api data uploads used maps transforms tilesets geographic applications,Help
91,high text preferred renderer provide labels priority staying visible variable map label positions chance anchor increase placement list,Android
92,kml google ’ file commonly products geospatial format,Help
93,vision navigation ar android introduction,Android
94,api images static works maps learn print map create and,Help
95,official documentation vision sdk android introduction overview,Android
96,adjust the zoom extent learn tilesets your tileset of manually,Help
97,api the tilequery with coordinate specified app use create tileset returns terrain elevation find,Help
98,show event map calendar locations integration,Android
99,marker property maps feature information click location map add query a display,Android
100,style styles map learn studio your made publish,Mapbox Studio manual
101,marker several annotation markers approach read map offers benefits and add ways,iOS
102,height 3d easily plugin use building in display,Android
103,camera symbollayer zoom-based change icon zoom level based icons switch,Android
104,optimized remove style-optimized vector represented features tile layers tiles style,Help
105,fontstacks optimal manage learn your rendering,Help
106,buildings provided iconic maps sdk example building overview unity scene,Unity
107,official documentation api sdk geocoder java geocoding,Android
108,official documentation api directions sdk direction java,Android
109,maps sdk android location device showing,Android
110,satellite project next works imagery learn use,Help
111,cases location based use overview game,Unity
112,fill button layer with change 's using setpaintproperty color a,Mapbox GL JS
113,official documentation maps china sdk android plugin inside read performance maximizes,Android
114,layer source vector tile map add a display,Android
115,share snapshot image send map,Android
116,overlap toggle text collide collision deny allow detection icons,Android
117,gl camera maps view map use field,Help
118,contains views embedded navigation view,Android
119,api associate access resources account token requests tokens uses,Help
120,collection draw point map points geojson,Mapbox GL JS
121,learn data traffic access file,Traffic Data
122,data real source uses update live time add,iOS
123,understand navigation listen user sdk android interaction ui,Android
124,property using identity function color style line visualization an,Android
125,securely how learn to use mapbox,Help
126,data using turf.js solve js analyze spatial and analysis turf add world context real with mapbox gl example problems guide map walks j,Help
127,gradient property visualize using paint point line distance create use an starting expression a,Mapbox GL JS
128,delimited api sources using source used feature new tilesets beta line create tileset geojson,Help
129,camera the position bearing zoom tilt map animate,Android
130,navigation functionality ios provides offline sdk environments connected non routing,iOS
131,collection source feature layers a style single create add shape multiple from,iOS
132,basic navigation application functionality app ios add,iOS
133,api add directions direction turn map routing,Help
134,documentation boundaries boundary v2 reference tileset mapbox,Vector tiles
135,understanding measure size ’ apk android app learn optimize,Help
136,for application build android integrate store a locator,Help
137,resources find help build,Help
138,api performs two reverse geocoding forward main tasks,Help
139,local data with join vector merging tile geometry choropleth json style geometries map,Android
140,coffee shops docs find place destinations easily android plugin favorite read nearby restaurants search stores places explore,Android
141,vector language graphics describing two dimensional scalable markup svg,Help
142,accounts browse information billing security overview,Help
143,movement camera animate animation,iOS
144,individual within layer source,Help
145,series showcase function multiple location to use jumpto locations of a jump,Mapbox GL JS
146,marker the with using ios maps place annotation sdk title a callout map an on add mark default,iOS
147,data using generate third custom party server route,iOS
148,marker using following along travels matched map speed geojson consistent route,Android
149,application works spatial turf learn use web analysis,Help
150,mapbox boundary boundaries extend tileset,Help
151,api curl upload using uploads learn to use mapbox,Help
152,systems lowest upon services apis objective c level service interfaces built web mapbox javascript,Help
153,data source simplestyle specification styling geojson open,Help
154,data-driven data for android styles based map create circle styling attribute,Help
155,data storing vector tile format lightweight points geospatial polygons lines,Help
156,learn reference studio interface,Mapbox Studio manual
157,work services ’ across directions direction learn platforms add applications,Help
158,api data tilequery specific allows vector features latitude based retrieve longitude tileset given,Help
159,data boundary with join boundaries v2 data-joins tileset mapbox,Help
160,displayed dynamically real change runtime style map styling time allows,Help
161,binding visualize using variable calculate density population expression display,Mapbox GL JS
162,bathymetry interpolate data curve cubic style depth ocean uses expression bezier,Mapbox GL JS
163,desktop toolkit data source spatial server access based map patterns mapnik algorithms mapping rendering providing open visualization,Help
164,professionally maps variety sdk style styles use designed ios default,iOS
165,area prevent restrict panning different place maxbounds to map an setting panned,Mapbox GL JS
166,adjust symbollayer text size color label fonts fields,Android
167,professionally maps variety sdk style styles use designed default,Android
168,articles navigation sdk troubleshooting help ios,iOS
169,system symbollayer icon interpolators android use animated icons movement animate,Android
170,quadtree data structure tree,Help
171,api gl documentation vector reference maps tiles styles render interactive js,Mapbox GL JS
172,atlas troubleshoot your installation,Atlas
173,local api the optional with using tutorial app parameters guides process search creating geocoding,Help
174,style classic map studio made,Help
175,popup add a display map,Mapbox GL JS
176,official documentation navigation faster faster-route sdk android read detection route,Android
177,boundaries boundary with v2 get tileset started mapbox,Help
178,api documents recipes recipe reference feature tile tilesets learn beta syntax correct transformation format,Help
179,below precise layer using second argument new label addlayer add a,Android
180,gl the set result improve relevance language to geocoder ui localize given a,Mapbox GL JS
181,work navigation instructions sdk maneuver learn instruction ios,iOS
182,mock engine navigation using session location,Android
183,provided maps sdk example map zoomable overview unity scene,Unity
184,high satellite basemap resolution imagery global mapbox,Help
185,change ’ language learn languages map label your s available,Help
186,marker property use continuously cluster js synchronize change objects custom svg clustered with pool advanced place view markers expressions updates clusters uses display manually gl layer source example html map clustering,Mapbox GL JS
187,data visualize circlelayer layers point use circle cluster clusters geojson,Android
188,toggles indoor floor map levels building switch display,Android
189,shift drag box within bounding using features feature queryrenderedfeatures hold map highlight key query a,Mapbox GL JS
190,api transform data recipes using tiling recipe feature example tilesets beta use learn custom,Help
191,general firewall configuration with troubleshooting tips working guidance behind,Help
192,tilesets manage studio learn create,Mapbox Studio manual
193,basic road navigation project blue-line ar blue view line device route,iOS
194,alignment provided world-scale maps ar sdk example scale manual overview unity world,Unity
195,position camera fit bounding box view markers given in,Android
196,gl visualize data change with changes application build show map over time j mapbox js,Help
197,maps annotation sdk location map ios defined,Help
198,shift high position text labels priority stay variable allow use label map anchor placement,Mapbox GL JS
199,location-based provided maps sdk example location based scene overview unity game,Unity
200,gl vector maps tiles library introduction styles render interactive webgl uses javascript js,Mapbox GL JS
201,learn traffic data formatted format,Traffic Data
202,accounts account service apis overview,API
203,vector features feature maps sdk map rendering overview unity,Unity
204,data real for source using reality maps sdk toolset location based map building augmented virtual open mapbox unity applications,Help
205,progress offline map track an download pack,iOS
206,experiment tools tool interactive,Help
207,data works detail hood extension flow visualization and,Geographic Analytics
208,examples example studio,Mapbox Studio manual
209,aligns raw gps map points match roads matching pathways,Android
210,official documentation navigation faster faster-route sdk android read detection route,Android
211,boundaries boundary with v2 get tileset started mapbox,Help
212,api documents recipes recipe reference feature tile tilesets learn beta syntax correct transformation format,Help
213,below precise layer using second argument new label addlayer add a,Android
214,gl the set result improve relevance language to geocoder ui localize given a,Mapbox GL JS
215,provided maps sdk example map zoomable overview unity scene,Unity
216,high satellite basemap resolution imagery global mapbox,Help
217,change ’ language learn languages map label your s available,Help
218,local api the optional with using tutorial app parameters guides process search creating geocoding,Help
219,popup add a display map,Mapbox GL JS
220,style classic map studio made,Help
221,shift drag box within bounding using features feature queryrenderedfeatures hold map highlight key query a,Mapbox GL JS
222,adjust layer satellite fade zoom level based raster opacity,Android
223,property using function categorically color style circle visualization categorical,Android
224,mock engine navigation using session location,Android
225,transition gl apps using mapbox.js to learn transitioning j mapbox from js,Help
226,gl the improve maps learn map performance j of mapbox js,Help
227,navigation progress along user information sdk learn use ios route,iOS
228,template style map create alter custom a,Help
229,unit measurement used view views map deprecated usage track formerly web,Help
230,under mouse the using elements feature queryrenderedfeatures show properties get map hovered pointer,Mapbox GL JS
231,data layer specific used rules layers styles subsets styling add,Help
232,controller use custom voice,iOS
233,timezone mapbox api finder tilequery with app create a,Help
234,mapbox the data with for microsoft choropleth power map create make bi visual a,Help
235,fragment 's user show location locationcomponent map use on a display,Android
236,mapbox fix image upload errors error learn troubleshooting studio in svg,Help
237,code examples vision sdk example ios,iOS
238,one interpolate ease layer change smoothly next zoom color level fade based building on uses expression,Mapbox GL JS
239,handlers toggle interaction map ui disable enable,Mapbox GL JS
240,data car congestion plugin use live traffic map real-time top display,Android
241,functionality geocoding region place country address location finding ui search add global world,Android
242,migrating +. earlier project v1.4 maps sdk v1 to guide versions 4 unity,Unity
243,weather image dark vector baselayer radar an add overlay,Mapbox GL JS
244,dragged annotation view views custom draggable,iOS
245,js code using application need build mapbox.js guide map walks store a locator,Help
246,add the icon runtime to map generated a,Mapbox GL JS
247,data boundary with boundaries v2 point-in-polygon tileset query mapbox,Help
248,button change various user runtime properties interaction based map styling situations,Android
249,gl with expression get learn expressions write started j mapbox js,Help
250,android plugins introduction overview,Android
251,documentation data-driven real changing maps sdk android feel look map styling time,Android
252,api add dynamically call point style derived points web interactive styled,iOS
253,documentation street reference streets tileset v8 mapbox,Vector tiles
254,navigation customize off-route sdk app android learn use detection route experience,Android
255,data managing application anything access tilesets styles related studio account tokens web mapbox,Help
256,mapbox apply tiles style classic raster designed studio map legacy use in a,iOS
257,raster add hillshading map adds,Mapbox GL JS
258,spatial library turf turf.js analysis javascript js,Help
259,data realtime move use live map symbol geojson add streams,Mapbox GL JS
260,layer source external service adding a map web add wms,Android
261,api adjust camera ischrone data info android seekbar retrieve isochrone use accordingly time slider display,Android
262,options option camera customize location locationcomponent map use behavior,Android
263,sometimes images tif file saving raster tiff format,Help
264,may tiles tile missing learn or map seeing blank,Help
265,maps sdk android gestures detecting gesture,Android
266,source frame line updating geojson animate a,Mapbox GL JS
267,documentation clicking within maps sdk android event read map moving events flinging,Android
268,work libraries application ’ learn integrate web javascript applications,Help
269,code examples android example working plugins,Android
270,adjust layer drag 's bar raster map seek top a opacity,Android
271,api one matrix times travel calculates many request points,Help
272,manage datasets studio create learn,Mapbox Studio manual
273,area prevent restrict panning different viewport place to map constraining an panned,iOS
274,scroll zooming zoom map prevents disable,Mapbox GL JS
275,statistic displayed interpret tracks learn usage statistics and page,Help
276,adjust position symbollayer text anchor fields,Android
277,image images source easily use map an display,Android
278,work sdks application mobile maps learn add,Help
279,maps sdk guides android tutorials get troubleshooting help started,Android
280,explorer provided data maps sdk example overview unity scene,Unity
281,value property within filter computing layout paint formula defines style map expression,Help
282,upload with indoor build map create floorplans floorplan mapbox,Help
283,linedistance measure using distanced click map distance create points turf lines,Mapbox GL JS
284,result beyond zoom extent zoomed tileset given overzoom,Help
285,control navigation zoom map obvious make controls display rotation,Mapbox GL JS
286,api documentation start examples tutorials help building references,Documentation
287,gl code examples example js,Mapbox GL JS
288,"gl using part point : markers to map 3 web clicked popups , add a interactivity js",Help
289,code examples maps sdk example ios,iOS
290,"containing part dataset point : new to map points create web , 1 add a",Help
291,atlas upgrade,Atlas
292,ids used vector identify tilesets raster map id,Help
293,manage learn account and setting settings management,Help
294,unit meters feet formula values convert use elevation,Mapbox Studio manual
295,camera control navigation fine sdk app click android learn map grain experience,Android
296,data provided source vector tile render third mapillary add a party,Mapbox GL JS
297,annotation android plugin,Android
298,directions direction show selected to map location based movement dotted route,Android
299,range zoom visible extent levels tileset,Help
300,area gl draw meters turf show use calculate drawn polygon square js,Mapbox GL JS
301,position camera fit bounding box view markers given in,Android
302,gl visualize data change with changes application build show map over time j mapbox js,Help
303,maps annotation sdk location map ios defined,Help
304,gl initialize element html map a display js,Mapbox GL JS
305,framer apps prototype with component x learn use map add in mapbox,Help
306,adjust change color extrusions location light and shined,Android
307,image clustered data property interval using images color point based to use cluster styling display,iOS
308,the with individual maps interacting sdk gestures map ios overview,iOS
309,experiment tools tool interactive,Help
310,data works detail hood extension flow visualization and,Geographic Analytics
311,examples example studio,Mapbox Studio manual
312,shift high position text labels priority stay variable allow use label map anchor placement,Mapbox GL JS
313,location-based provided maps sdk example location based scene overview unity game,Unity
314,gl vector maps tiles library introduction styles render interactive webgl uses javascript js,Mapbox GL JS
315,learn traffic data formatted format,Traffic Data
316,accounts account service apis overview,API
317,aligns raw gps map points match roads matching pathways,Android
318,vector features feature maps sdk map rendering overview unity,Unity
319,add js context data real with using analyze spatial turf example problems mapbox.js guide map walks and turf.js analysis solve world,Help
320,snapshot static object map create a,iOS
321,height 3d extrusions use building in display buildings,Mapbox GL JS
322,navigation feature sdk android inside reroute test,Android
323,data real for source using reality maps sdk toolset location based map building augmented virtual open mapbox unity applications,Help
324,progress offline map track an download pack,iOS
325,astronaut provided maps sdk version example location enhanced based unity game,Unity
326,official documentation data visualize much customize maps sdk introduction android app learn overview,Android
327,vision alert android introduction safety,Android
328,texturing maps sdk map styling overview unity buildings,Unity
329,io understanding measure size ’ app learn ios optimize framework,Help
330,extension started getting,Geographic Analytics
331,io iphone for source ipad maps devices sdk toolset map building mapping ios open mapbox applications,Help
332,context provides baselayer point map geographic serves starting,Help
333,libraries easily app introduction android location handle connectivity permissions device overview core,Android
