,text_final,site_final
334,data attribution maps stating two map created combination placed tools elements visual,Help
335,io the submission with for maps sdk app issues troubleshoot learn troubleshooting map built frequently seen ios store mapbox submitting applications,Help
336,customize application app style map styling ui and elements,iOS
337,video satellite baselayer play click raster map pause add top a,Mapbox GL JS
338,layer style render use custom webgl add a content,Mapbox GL JS
339,vision ios sdk introduction,iOS
340,data gpx gps receivers format created commonly exchange,Help
341,api hosted vector tiles tile single request tileset allows,Help
342,api specific geocoding receive information use request make geocode coordinates a,Android
343,learn browsers browser product support,Help
344,the canvas icon runtime generated to map animated an add,Mapbox GL JS
345,the image with place annotation point a map custom an on add mark,iOS
346,example ar overview tabletop,Unity
347,known ids used vector identify tilesets raster map tileset id previously,Help
348,svg upload icon map custom add a,Mapbox Studio manual
349,adjust layer satellite fade zoom level based raster opacity,Android
350,property using function categorically color style circle visualization categorical,Android
351,transition gl apps using mapbox.js to learn transitioning j mapbox from js,Help
352,gl the improve maps learn map performance j of mapbox js,Help
353,navigation progress along user information sdk learn use ios route,iOS
354,template style map create alter custom a,Help
355,unit measurement used view views map deprecated usage track formerly web,Help
356,under mouse the using elements feature queryrenderedfeatures show properties get map hovered pointer,Mapbox GL JS
357,data layer specific used rules layers styles subsets styling add,Help
358,controller use custom voice,iOS
359,timezone mapbox api finder tilequery with app create a,Help
360,gl with heatmap html a style markers custom make tooltips add j mapbox js,Help
361,draw parsing maps sdk file line polyline geojson a,Android
362,api tilequery vector features tiles retrieve playground,Help
363,served services data apis file map geojson web format,Help
364,"2 upload template part point : style to map studio create web icons tileset , custom add a",Help
365,for mobile maps sdk library managed map integrating native react apps community,Help
366,flyoptions using location fly to slowly flyto a,Mapbox GL JS
367,maps anonymous sensors process based moving create people telemetry,Help
368,one interpolate ease layer change smoothly next zoom color level fade based building on uses expression,Mapbox GL JS
369,code examples vision sdk example ios,iOS
370,handlers toggle interaction map ui disable enable,Mapbox GL JS
371,data car congestion plugin use live traffic map real-time top display,Android
372,functionality geocoding region place country address location finding ui search add global world,Android
373,migrating +. earlier project v1.4 maps sdk v1 to guide versions 4 unity,Unity
374,weather image dark vector baselayer radar an add overlay,Mapbox GL JS
375,destination add custom marker,iOS
376,data large for with files view file manage scale learn studio make tippecanoe big independent mapbox,Help
377,dynamically data-driven layer data style circle styling driven,iOS
378,generation navigation routes sdk android learn generate use ui route,Android
379,provided world-scale maps ar example sdk scale overview unity world,Unity
380,parse data python csv files example learn use traffic manipulate,Traffic Data
381,code nearest need build sort location guide by distance walks search lets store locator,Help
382,property data-driven data with color style line visualization creating expression a,Mapbox GL JS
383,general configuration tableau using maps style use tips custom guidance in mapbox,Help
384,the using a map clicked flyto events symbol on center,Mapbox GL JS
385,applications services monthly within accessed number user mau active month given users,Help
386,code road real requires discover android plugin two map traffic time lines display,Android
387,image images containing annotation annotations view views and add multiple,iOS
388,api datasets remove features dataset update read create allows,Help
389,data visualize effect china point example driven use lapse rainfall styling time,Android
390,below precise layer using second argument new label addlayer add a,Mapbox GL JS
391,api datasets using dataset related use requests make id,Help
392,replace provided features maps feature sdk example overview unity scene,Unity
393,official documentation api tilequery sdk java,Android
394,dynamically layer source style line polyline geojson add a from,iOS
395,data vector height 3d extrusions based use building on imported display,Android
396,navigation shows using different navigationmaproute styles map route,Android
397,layer satellite style map base use,iOS
398,library mapbox.js map website interactive add allows javascript js,Help
399,circles set layer property data radii based circle radius,Android
400,speeding alert display vehicle,Android
401,ios plugin china introduction brief,iOS
402,documentation vector reference introduction maintained tilesets,Vector tiles
403,data works learn studio uploading geospatial,Mapbox Studio manual
404,used build language styles classic studio cartocss,Help
405,destination add custom marker,iOS
406,data large for with files view file manage scale learn studio make tippecanoe big independent mapbox,Help
407,dynamically data-driven layer data style circle styling driven,iOS
408,generation navigation routes sdk android learn generate use ui route,Android
409,provided world-scale maps ar example sdk scale overview unity world,Unity
410,parse data python csv files example learn use traffic manipulate,Traffic Data
411,code nearest need build sort location guide by distance walks search lets store locator,Help
412,property data-driven data with color style line visualization creating expression a,Mapbox GL JS
413,general configuration tableau using maps style use tips custom guidance in mapbox,Help
414,fill water something render surface create moving transparent background,Android
415,api optimized provided duration returns optimization coordinates input route,Help
416,"window layer data symbollayer show info "". use icons symbol bubblelayout",Android
417,bathymetry data water show depth use styling driven display,Android
418,draw vector maps sdk map polygon a,Android
419,marker specific picker drop location reverse geocoding perform,Android
420,the using a map clicked flyto events symbol on center,Mapbox GL JS
421,applications services monthly within accessed number user mau active month given users,Help
422,code road real requires discover android plugin two map traffic time lines display,Android
423,image images containing annotation annotations view views and add multiple,iOS
424,api datasets remove features dataset update read create allows,Help
425,data visualize effect china point example driven use lapse rainfall styling time,Android
426,fill set layer change 's using color a,Android
427,bound bounds the fit linestring last extend first get include to passing chaining lnglatbounds coordinates of a,Mapbox GL JS
428,layer 3d a style to map studio building add mapbox,Help
429,fill layer polygon style type geojson add a,Mapbox GL JS
430,the current locate using user geolocatecontrol geolocate location map track,Mapbox GL JS
431,documentation v2 reference tileset terrain mapbox,Vector tiles
432,practices formatting address guide addresses follow best geocoding format,Help
433,data using maps sdk styles map custom overview unity,Unity
434,practices collaborating practice learn account collaboration best setting projects,Help
435,static false non-interactive map create interactive setting a display,Mapbox GL JS
436,markerview docs customize android view markers based quickly read map plugin add,Android
437,typing layer within filter features feature vector tile view move map viewable query input,Mapbox GL JS
438,map service overview apis maps,API
439,current for tracking receive android updates location map device display,Help
440,the navigation sdk carplay learn use support ios in,iOS
441,area box bounding describing map particular mechanism,Help
442,provided simulator maps sdk example city overview unity scene,Unity
443,navigation voice text used instructions sdk maneuver android milestones learn custom trigger ui instruction core default,Android
444,see camera with change rotate 3d tilt building and around device buildings,Android
445,gl displayed dropdown with function customize menu html use render custom geocoder rendering a,Mapbox GL JS
446,attribution learn built add required applications,Help
447,collaborative project openstreetmap creates worldwide base map mapping,Help
448,count bounding box feature get inside highlight buildings,Android
449,satellite baselayer raster map a display,Mapbox GL JS
450,reducing sources source limit number style styles read studio tileset strategies in mapbox,Help
451,documentation layer offical quick show plugin android location map device steps,Android
452,local data with join vector merging tile geometry choropleth json style geometries,Mapbox GL JS
453,source vector tile map add a,Mapbox GL JS
454,started atlas introduction get,Atlas
455,layer geojson click selected single highlight on polygon,Android
456,navigation functionality provides offline sdk android environments connected non routing,Android
457,mapbox apply maps sdk style use designed studio created ios in a,iOS
458,documentation v5 street reference streets tileset mapbox,Vector tiles
459,interaction based interactions map recyclerview manipulate,Android
460,the override customize user annotation location default,iOS
461,containing user information show click popup clicks on polygon,Mapbox GL JS
462,toggling value property data set filter based by symbols symbol a list,Mapbox GL JS
463,source line animated polyline geojson add animate a,iOS
464,across resolve troubleshooting products issues common,Help
465,marker specific coordinate representation map visual,Help
466,navigate region delete offline view download manager,Android
467,atlas legacy,Atlas
468,showcase data directions direction traffic and,Unity
469,adjust layer drag 's range raster map slider top a opacity,Mapbox GL JS
470,navigation within source provides mobile sdk toolset turn integrating open mapbox applications,Help
471,desktop application styles classic studio designing mapbox,Help
472,for source maps devices sdk android toolset map building mapping open mapbox applications,Help
473,api libraries programming application software interact specification interface,Help
474,api gl affect control using results parameters geocoder use places search geocoding check add playground query a explore,Mapbox GL JS
475,code examples navigation sdk example android,Android
476,developing vision testing sdk strategies development and overview,Android
477,local url load locally or style raster via json custom map file stored,Android
478,image aerial take georeferenced imagery get non map help historical qgis onto georeference,Help
479,product atlas other with use products mapbox,Atlas
480,statistic result understand monthly invoice invoices inconsistency inconsistencies might statistics and situations page in,Help
481,error errors cors learn address,Help
482,text for customize expressions single use label studio alter a,Help
483,code examples maps sdk example android,Android
484,one load with icon provide missing style failed,Android
485,data satellite using webpage tool imagery process learn raster line command processing rasterio find publish,Help
486,api within reachable features areas specified show location isochrone line request time polygon allows amount,Help
487,dynamic context visualizations features maps user runtime interaction use create styling respond,iOS
488,current toggle fullscreen mode view map a,Mapbox GL JS
489,blocks provides learn create custom building mapping overview applications,Help
490,boundaries boundary with get v1 tileset started mapbox,Help
491,dependency atlas install dependencies,Atlas
492,api vector delete tilejson metadata tilesets retrieve raster allows list,Help
493,snake directions rather direction origin destination showing snaking route,Android
494,pixel the mouse position coordinate latitude get hover longitude pointer coordinates of showing,Mapbox GL JS
495,io practices for overivew maps design map use best ios designing,iOS
496,learn openlayers use mapbox with,Help
497,official documentation api sdk isochrone java,Android
498,style add layer a heatmap,Mapbox Studio manual
499,containing user information show popup hover symbol on a display hovers,Mapbox GL JS
500,apis service overview search,API
501,using depending tolerance utility amount making reduces polyline coordinates simplify a polylines,Android
502,data-driven data spatial properties style based styling driven allows,Help
503,symbollayer using listen icon listeners annotation interaction plugin built symbol listener,Android
504,fix csv errors files file error learn uploading,Help
505,collection data grid vector zoom 22 tiles preset uniform raster levels tileset square broken,Help
506,engine profile set optimal uses rules two points routing find route,Help
507,plugin android localization,Android
508,arrives waypoint message user screen arrival display,iOS
509,learn elevation tilesets data access,Help
510,api work fill see navigation apis parameters search playground,API Playground
511,extension the configure,Geographic Analytics
512,fragment gaming great link larger interaction show map two inset smaller,Android
513,draw vector maps annotation sdk polygon map ios add a,iOS
514,pixel efficiently data based raster surfaces rasters represent format continuous,Help
515,generation navigation routes sdk learn generate use ios route,iOS
516,data upload source find country style single studio open a,Help
517,troubleshoot how access regain learn to lockout account scenarios your common,Help
518,io apps protect source used private android access learn keep others token and tokens open in,Help
519,articles maps sdk troubleshooting help ios,iOS
520,download atlas install set,Atlas
521,online basemap arcgis a style map studio add in mapbox,Help
522,speeding alert display vehicle,iOS
523,collection layer within stack individual style font belong fonts,Help
524,tilesets mbtiles format storing file,Help
525,fix image images with troubleshoot backgrounds learn black raster background display,Help
526,io the pin placing with for maps getting sdk walk first screen map installing step ios mapbox,Help
527,gl understand including relationship interact tile billing views map usage requests loads playground units j mapbox js,Help
528,attribution maps sdk learn use add unity applications,Unity
529,count using estimator number region maps tiles tile offline sdk android estimate download ios required mapbox,Help
530,set text change language automatically plugin to map use label device,Android
531,gl data source supplies maps shown use,Help
532,api gl results directions direction plugin show click destination map use origin driving add display,Mapbox GL JS
533,leaflet source library basis forms mapping web open js,Help
534,navigationview fragment implemented with,Android
535,messages data upload uploads interpret troubleshoot error to learn failed mapbox prepare,Help
536,mapbox general the with using configuration microsoft power tips integrate bi guidance visual,Help
537,local uses text labels language country expression style label and rich format display english,Mapbox GL JS
538,using effect feature states hover per create events a,Mapbox GL JS
539,marker code recreate specific application android view map platform native react playground ios add web,Help
540,visualize layer using heatmap data earthquake create a,iOS
541,gl visualize style use points create built cluster clusters and functions js,Mapbox GL JS
542,image data source changes show use lapse time runnable,Android
543,set data height heights driven to use styling geojson extrusion,Android
544,url reference style studio created allows,Help
545,region limited network offline conditions connection use map and pack defined available,Help
546,set icon designers map maki developed,Help
547,unit physical expressed e etc ). miles define g use generate circle kilometers turf units in a radius,Android
548,line geojson add a map,Mapbox GL JS
549,hole outlined region outline revealed highlight polygon,Android
550,navigation for application build app android integrate a,Help
551,conversion point screen location convert geographic coordinates,iOS
552,the control navigate with move map like around game-like controls game,Mapbox GL JS
553,application works maps sdk get learn use building started unity applications,Help
554,api debug errors feature troubleshoot tilesets error beta learn common,Help
555,zoom bar level scale based distance add determine,Android
556,accounts transfer between style learn styles account,Help
557,style document map appearance defines visual,Help
558,api far visualize using within allows drive users isochrone create amount with app walk time could started web the bike get given,Help
559,layer source external service adding a map web add wms,Mapbox GL JS
560,mobile maps map label web placement optimize,Help
561,documentation v7 street reference streets tileset mapbox,Vector tiles
562,maps expression sdk android,Android
563,application maps 3d sdk top map use create visualization terrain in a unity buildings,Help
564,io the data using with for ios sdk get styles based map attribute create circle started expression mapbox,Help
565,run atlas,Atlas
566,navigation progress along user sdk information android learn use ui route,Android
567,change 's another style map switch a,Mapbox GL JS
568,official documentation navigation sdk android introduction overview,Android
569,api pairs matrix coordinate source element used destination request elements mapbox,Help
570,outline layer building show query,Android
571,navigation view drop create ui experience,Android
572,service navigation overview apis,API
573,web services introduction apis,API
